<?xml version="1.0" encoding="UTF-8"?>
<!DOCTYPE fci SYSTEM "ASP_DTD.dtd">
<fci>
    <dog_breeds>
        <dog_breed standart_number="SN166" group="GR1" section="S1.1">
            <name>Немско овчарско куче</name>
            <country country_code="GER"  capital="Berlin" official_language="German" time_zone = "UTC/GMT +1 hour"  currency="Euro">
                <country_name>Гемрания</country_name>
                <country_continent>Европа</country_continent>
                <country_government_type>Демокративна и федерална република</country_government_type>
            </country>
            <year_of_establishment>1899</year_of_establishment>
            <head>Дължината на главата е пропорционална на големината на тялото и представлява 40 % от височината при холката.
                В общи линии главата трябва да е суха, с умерена ширина между ушите.
                Ширината на главата трябва да отговаря на нейната дължина.
                При мъжките е допустимо главата да е малко по-широка, а при женските да е малко по-тясна.
            </head>
            <teeth>Трябва да са здрави, силни и компактни (общо 42 зъба, от които 20 в горната челюст и 22 в долната челюст).
                Захапката е ножицоподобна.Недопустима е предна, задна или клещоподобна захапка, 
                а също така и по-големи разстояния между зъбите.
            </teeth>
            <ears>
                Средноголеми, широки в основата, високо поставени, стърчащи нагоре, заострени, насочени напред.
                Не трябва да са завити навътре. За недостатък се приемат клепналите, скъсените, а така също и насочените право нагоре уши.
                За недостатък се приема, когато кучето при движение, а понякога и когато лежи, прилепва ушите си към главата.
                До 6 месечна възраст, а понякога и до по-късно, ушите могат да бъдат увиснали или завити навътре.
            </ears>
            <eyes>
                Средноголеми с бадемовидна форма, леко косо поставени. Не трябва да са изпъкнали.
                Цветът им е според цвета на космената покривка, желателно да е тъмен.
                Погледът е жив, умен и самоуверен.
            </eyes>
            <tail>
                Богато окосмена, стигаща най-малко до скакателните стави. Не трябва да е по-дълга от средата на метатарзусите.
                Недопустима е влачещата се по земята опашка.
                Недопустими са отклоненията встрани. 
            </tail>
            <colors>
                <primary_color>Черна с равномерни кафяви, жълти до светлосиви петна</primary_color>
                <secondary_color>Изцяло черен цвят или Едноцветно сива</secondary_color>
                <prefered_color> Черна с равномерни кафяви, жълти до светлосиви петна </prefered_color>
            </colors>
            <fur>По отношение на дължината е три типа:
                Късокосместо немско овчарско куче,
                Дългоравнокосместо немско овчарско куче,
                Дългокосместо немско овчарско куче
            </fur>
            <image>https://skydrive.live.com/redir?resid=6F26B1E0D6CF648E!299</image>
            <size>
                <males_size>62,5 см измерено при холката ( +/- 2.5 см)</males_size>
                <females_size>57,5 см измерено при холката ( +/- 2.5 см)</females_size>
            </size>
            <weight>
                <males_weight>30-45 кг</males_weight>
                <females_weight>22-32 кг</females_weight>
            </weight>
        </dog_breed>
        <dog_breed standart_number="SN297" group="GR1" section="S1.1">
            <name>Бордър Коли</name>
            <country country_code="GBR"  capital="London" official_language="British English" time_zone = "No UTC/GMT offset"  currency="Pound">
                <country_name>Великобритания</country_name>
                <country_continent>Европа</country_continent>
                <country_government_type>Монархия</country_government_type>
            </country>
            <year_of_establishment>1987</year_of_establishment>
            <head>
                Череп: Сравнително широк, без изразен тил.
                Стоп: Много отчетлив.
            </head>
            <teeth> Зъбите и челюстите са здрави с перфектна, симетрична и пълна ножична захапка, т.е. 
                горните резци плътно припокриват долните и са поставени перпендикулчрно на челюстите.
            </teeth>
            <ears>
                Среден размер и текстура, поставени доста в страни. 
                Носят се изправени или полуизправени и са чувствителни при използване.
            </ears>
            <eyes>
                Разположени широко встрани, с овална форма, умерено големи, кафеви на цвят, с изключение на мраморно оцветените кучета, при които едното или и двете, или части от едното или от двете очи, могат да са сини. 
                Изражението е благородно, пронизително, будно и интелигентно.
            </eyes>
            <tail>
                Умерено дълга, коста стига най-малко до скакателните стави, поставена ниско, добре окосмена и с извивка нагоре в края, завършваща елегантния контур и баланс на кучето.
                Опашката може да се повдигне при вълнение, но никога не се носи над линията на гърба.
                
            </tail>
            <colors>
                <primary_color>Черна с бяло</primary_color>
                <secondary_color>Изцяло черно</secondary_color>
                <prefered_color> Бялото не трябва да преобладава</prefered_color>
            </colors>
            <fur>Два варианта: Умерено дълъг или гладък.
                И при двата варианта, покривния косъм е гъст и с умерена текстура, подкосъма е мек и гъст с добра водоустойчивост. 
                При умерено дългокосместия вариант, обилна козина формира грива, "бричове" и "четка". По лицето, ушите, предните крайници (изключвайки украсяващия косъм), 
                задните крайници от скакателните стави до лапите, косъмът трябва да е къс и гладък.
            </fur>
            <image>https://skydrive.live.com/redir?resid=6F26B1E0D6CF648E!307</image>
            <size>
                <males_size>53,5 см измерено при холката ( +/- 2.5 см)</males_size>
                <females_size>51,5 см измерено при холката ( +/- 2.5 см)</females_size>
            </size>
            <weight>
                <males_weight>27-30 кг</males_weight>
                <females_weight>24-27 кг</females_weight>
            </weight>
        </dog_breed>
    </dog_breeds>
    <sections>
        <section section_id="S1.1">Овчарски и пастирски кучета</section>
    </sections>
    <groups>
        <group group_code="GR1">ОВЧАРСКИ И ПАСТИРСКИ КУЧЕТА. КУЧЕТА ПОДКАРВАЧИ</group>
    </groups>
</fci>