<?xml version="1.0" encoding="UTF-8"?>
<!DOCTYPE fci SYSTEM "ASP_DTD.dtd">
<fci>
    <dog_breeds>
        <dog_breed standart_number="SN97" group="GR5" section="S5.2">
            <name>Померан</name>
            <country  country_code="GBR" capital="London" official_language="British English" time_zone = "No UTC/GMT offset"  currency="Pound">
                <country_name>Великобритания</country_name>
                <country_continent>Европа</country_continent>
                <country_government_type>Монархия</country_government_type>
            </country>
            <year_of_establishment>1998</year_of_establishment>
            <head>
                Средноголяма, гледана отгоре изглежда най-широка в задната част и се стеснява в посока към върха на носа.
                Стоп: Средноизразен до дълбок, но никога рязък
            </head>
            <teeth>
                Челюстите са нормално развити и с пълна ножична захапка с 42 налични зъба, съответствено на зъбната формула на кучето,
                т.е. горните зъби плътно припокриват долните и са поставени в равна редица в челюстта. 
                При миниатюрния и той (померанския) шпиц липсата на няколко премолара се позволява. 
                Клещовидна захапка е позволена при всички разновидности на шпица.
            </teeth>
            <ears>
                Малките уши са поставени високо и относително близо едно до друго, триъгълни и заострени. Винаги са носени изправени, връхчетата не се клатят.
            </ears>
            <eyes>
                Очите са средни по големина, издължени, леко наклонени и тъмни. Ръбът на клепачите е черен при всички цветови разновидности, тъмнокафяв при кафявите кучета.
            </eyes>
            <tail>
                Опашката е поставена високо и е средно дълга. 
                Издига се нагоре и се завива над гърба, направо от основата. 
                Лежи плътно върху гърба и е покрита с много пухкава козина. 
                Допуска се да е двойно навита при връхчето.
            </tail>
            <colors>
                <primary_color>Черно, кафяво, бяло</primary_color>
                <secondary_color> Оранжево, зонарно сиво</secondary_color>
                <prefered_color>Няма предпочитания в окраската</prefered_color>
            </colors>
            <fur>
                Немският шпиц има двойна козина дълъг, прав и стърчащ покривен косъм и къс, гъст и подобен на памук и вълна едновременно подкосъм. 
                Главата, ушите, предната страна на крайниците и лапите са покрити с къс и гъст копринен косъм. Останалата част от тялото е с дълго, богато окосмяване. 
                Козината не е вълниста, къдрава или на шнурове, не се разделя на път на гърба. Вратът и раменете са покрити с гъста грива. 
                От задната страна на бедрата има буйно окосмяване, от крупата до скакателните стави. Опашката е пухкава.
            </fur>
            <image>https://skydrive.live.com/redir?resid=6F26B1E0D6CF648E!327</image>
            <size>
                <males_size>20 см. +/- 2 см.</males_size>
                <females_size>20 см. +/- 2 см.</females_size>
            </size>
            <weight>
                <males_weight>Трябва да има тегло, съответстващо на ръста.</males_weight>
                <females_weight>Трябва да има тегло, съответстващо на ръста.</females_weight>
            </weight>
        </dog_breed>
        
        <dog_breed standart_number="SN306" group="GR5" section="S5.4">
            <name>Западносибирска лайка</name>
            <country country_code="RUS"  capital="Moscow" official_language="Russian"  time_zone = "UTC/GMT +4 hours"  currency="Russian Ruble">
                <country_name>Русия</country_name>
                <country_continent>Евро-Азия</country_continent>
                <country_government_type>Федерация</country_government_type>
            </country>
            <year_of_establishment>1996</year_of_establishment>
            <head>
                Не голяма.
                Черепна област:
                Череп: Подобен по форма на равностранен триъгълник.
                Стоп: Прехода от черепа към муцуната е постепенен, едва забележим.
            </head>
            <teeth>
                Бели, големи; ножична захапка.
            </teeth>
            <ears>
                Изправени, поставени високо, заострени.
            </ears>
            <eyes>
                Овални, полегати, тъмни на цвят.
            </eyes>
            <tail>
                Силно навита; носи се над гърба или бедрото.
            </tail>
            <colors>
                <primary_color> Бял, сол-пипер</primary_color>
                <secondary_color> червен и сив във всички нюанси</secondary_color>
                <prefered_color>черният цвят е приемлив, както и двуцветни и на петна от изброените цветове.</prefered_color>
            </colors>
            <fur>
                Твърд защитен косъм, добре развид подкосъм. Покриващата козина е права и груба.
                Благодарение на добре развитият подкосъм, тя е до известна степен "щръкнала" и изглежда буйна. По главата, ушите и предната част на крайниците, козината е къса; по холката, 
                шията, раменете и задната част на крайниците, косъмът е по-дълъг; той формира бакенбарди по скулите, яка по шията и украса от прави косми по задните крайници.
            </fur>
            <image>https://skydrive.live.com/redir?resid=6F26B1E0D6CF648E!328</image>
            <size>
                <males_size>от 54 до 60 см.</males_size>
                <females_size>от 52 до 58 см.</females_size>
            </size>
            <weight>
                <males_weight>35-40 кг.</males_weight>
                <females_weight>32-38 кг.</females_weight>
            </weight>
        </dog_breed>
    </dog_breeds>
    <sections>
        <section section_id="S5.4">Европейски шпицове</section>
        <section section_id="S5.2">Северни ловни породи</section>
    </sections>
    <groups>
        <group group_code="GR5">ШПИЦОВЕ И ДРУГИ ПРИМИТИВНИ ПОРОДИ</group>
    </groups>
</fci>