<?xml version="1.0" encoding="UTF-8"?>
<!DOCTYPE fci SYSTEM "ASP_DTD.dtd">
<fci>
    <dog_breeds>
        
        <dog_breed standart_number="SN61" group="GR2" section="S2.2">
            <name>Санбернар</name>
            <country country_code="SWZ"  capital="Bern" official_language="German/French" time_zone = "UTC/GMT +1 hour"  currency="Swiss franc">
                <country_name>Швейцария</country_name>
                <country_continent>Европа</country_continent>
                <country_government_type>Демократична федерална република</country_government_type>
            </country>
            <year_of_establishment>1985</year_of_establishment>
            <head>
                Главата е голяма с леко квадратна форма и характерни бръчки по челото.
      
            </head>
            <teeth>
                Имат много силни зъби. Захапката може да бъде клещовидна или ножична.
                Допуска се презахапка и липса на премолар 1
                
            </teeth>
            <ears>
                Ушите са с триъгълна форма и леко повдигнат заден край. Предният ушен край прилепва към бузите
                
            </ears>
            <eyes>
                Очите са средно големи и дълбоко поставени.
            </eyes>
            <tail>
                Опашката е дълга, покрита обилно с козина. Когато кучето е в покой, тя виси отпусната надолу или е с леко извит край нагоре. Когато кучето е възбудено тя се извива нагоре.
                
                
            </tail>
            <colors>
                <primary_color>Кафеви петна на бял фон</primary_color>
                <secondary_color>Черно-кафеви петна на бял фон</secondary_color>
                <prefered_color> И двете разновидности са енакво ценени</prefered_color>
            </colors>
            <fur>
                Санбернарът се отличава с гъста, обилна и водоустойчива козина по цялото тяло. В зависимост от дължината й се различават 
                2 типа космена покривка при породата:дългокосмести и късокосмести
                               
            </fur>
            <image>https://skydrive.live.com/redir?resid=6F26B1E0D6CF648E!317</image>
            <size>
                <males_size>70-90 см</males_size>
                <females_size> 65-80 см</females_size>
            </size>
            <weight>
                <males_weight>над 35 кг</males_weight>
                <females_weight>над 30 кг</females_weight>
            </weight>
        </dog_breed>
        <dog_breed standart_number="SN101" group="GR9" section="S9.1">
            <name>Френски булдог</name>
            <country country_code="FRA"  capital="Paris" official_language="French" time_zone = "UTC/GMT +1 hour"  currency="Euro">
                <country_name>Франция</country_name>
                <country_continent>Европа</country_continent>
                <country_government_type>Република</country_government_type>
            </country>
            <year_of_establishment>1994</year_of_establishment>
            <head>
                Главата е къса, спрямо дължината на черепа. Имат сплескана муцуна - брахицефална порода.
               
            </head>
            <teeth>
                Имат много силни зъби. Захапката е обратна.
               
                
            </teeth>
            <ears>
                Ушите им са тип "прилепски". По - ранните развъдчици са предпочитали клепнали розови уши, но сега всички
                Френски булдози трябва да са с "прилепски уши". В основата са по - широки, а към върха се стесняват.
                
            </ears>
            <eyes>
                Имат големи очи с овална форма, значително раздалечени едно от друго.
               
            </eyes>
            <tail>
                Опашката може да бъде права или навита. Сравнително къса е, като в основата е по - дебела.
                                
            </tail>
            <colors>
                <primary_color>Кафеви на ивици или светло оранжеви</primary_color>
                <secondary_color>Бяла или черна</secondary_color>
                <prefered_color> И двете разновидности са енакво ценени може и спесица от тях</prefered_color>
            </colors>
            <fur>
                Френският булдог имат много къса, гладка, мека и права козина, което улеснява и нейната поддръжка.
                
            </fur>
            <image>https://skydrive.live.com/redir?resid=6F26B1E0D6CF648E!318</image>
            <size>
                <males_size>25-30 см</males_size>
                <females_size> 25-30 см</females_size>
            </size>
            <weight>
                <males_weight>8-10 кг</males_weight>
                <females_weight>7-9 кг</females_weight>
            </weight>
        </dog_breed>
    </dog_breeds>
    <sections>
        
        <section section_id="S2.2">Догообразни</section>
        <section section_id="S9.1">Бишони и подобни породи</section>
    </sections>
    <groups>
        <group group_code="GR2">ПИНЧЕРИ И ШНАУЦЕРИ. ДОГООБРАЗНИ И ШВЕЙЦАРСКИ ПАСТИРСКИ КУЧЕТА</group>
        <group group_code="GR9">КУЧЕТА ЗА КОМПАНИЯ И ДЕКОРАТИВНИ (ТОЙ)</group>
    </groups>
    
</fci>