<?xml version="1.0" encoding="UTF-8"?>
<!DOCTYPE fci SYSTEM "ASP_DTD.dtd">
<fci>
    <dog_breeds>
       
     <dog_breed standart_number="SN161" group="GR6" section="S6.1">
            <name>Бийгъл</name>
         <country  country_code="GBR" capital="London" official_language="British English" time_zone = "No UTC/GMT offset"  currency="Pound">
		        <country_name>Великобритания</country_name>
		        <country_continent>Европа</country_continent>
		        <country_government_type>Монархия</country_government_type>
		    </country>
            <year_of_establishment>1990</year_of_establishment>
            <head>
Породата се отличава с  добро телосложение. Главата е с умерена дължина и пропорционална на тялото.
           </head>
            <teeth>  
			Челюстите трябва да са здрави, с перфектна, правилна и завършена ножична захапка.
            </teeth>
            <ears>
                Ушите им са доста широки, дълги и висящи, със заоблени върхове. С дължината им средно 18 см те улавят миризмите и ги задържат близо до носа.
				Ушите и носът им са като Батман и Робин. 
				Без тях Биглите няма да са "супер гончетата", които всички познават.




            </ears>
            <eyes>
			Очите им не са поставени много дълбоко и имат добродушно изражение.

           </eyes>
            <tail>
               Опашката е поставена високо. Има средна дължина. Здрава и сравнително дебела е.

            </tail>
            <colors>
                <primary_color>Лимонено - жълта и бяла</primary_color>
                <secondary_color>Жълтеникаво - кафява и бяла</secondary_color>
                <prefered_color> И двете разновидности са приемливи</prefered_color>
            </colors>
            <fur> 
			Биглите имат лъскава, гладка и сравнително къса космена покривка, която е с твърд горен слой.
			В долната част на опашката косъмът е малко по - дълъг.

            </fur>
         <image>https://skydrive.live.com/redir?resid=6F26B1E0D6CF648E!309</image>
            <size>
                <males_size>33 - 41 см </males_size>
                <females_size> 33 - 41 см</females_size>
            </size>
            <weight>
                <males_weight>Около 17 кг </males_weight>
                <females_weight>Около 15 кг </females_weight>
            </weight>
        </dog_breed>
		
      <dog_breed standart_number="SN153" group="GR6" section="S6.3">
            <name>Далматинец</name>
		    <country country_code="CRO"  capital="Zagreb" official_language="Croatian" time_zone = "UTC/GMT +1 hour"  currency="Kuna">
		        <country_name>Далмация/Република Хърватска</country_name>
		        <country_continent>Европа</country_continent>
		        <country_government_type>Унитарна парламентарна конституциална република</country_government_type>
		    </country>
            <year_of_establishment>1985</year_of_establishment>
            <head>
Отличават се със стегнато тяло и силно развити мускули. Главата им е умерено широка.
			</head>
            <teeth>  
			 Челюстите са с ножицовидна захапка.
            </teeth>
            <ears>
                Ушите са средно дълги, висящи и леко клепнали.

            </ears>
            <eyes>
			Имат средни по размер очи, които са с  кръгла форма.

           </eyes>
            <tail>
               Опашката е дълга, като в основата е по - дебела, а към края изтънява.
				Носи се над гърба, а когато опашката е отпусмата, придобива саблевидна форма и стига до скакателните стави.
            </tail>
            <colors>
                <primary_color>Бяло с черни петна</primary_color>
                <secondary_color>Бяло с кафеви петна</secondary_color>
                <prefered_color> Бяло с черни петна</prefered_color>
            </colors>
            <fur> 
			Всички Далматинци са с къса и прилепнала към тялото козина. Космената покривка е гладка, гъста, твърда и лъскава, плътно покриваща цялото тяло.
            </fur>
		    <image>https://skydrive.live.com/redir?resid=6F26B1E0D6CF648E!303</image>
            <size>
                <males_size>56 - 61 см </males_size>
                <females_size> 54 - 59 см</females_size>
            </size>
            <weight>
                <males_weight>27 - 32 кг </males_weight>
                <females_weight>24 - 29 кг </females_weight>
            </weight>
		</dog_breed>
       
       
    </dog_breeds>
    <sections>
        <section section_id="S6.1">Гончета (следотърсачи)</section>
        <section section_id="S6.3">Подобни породи</section>
       
    </sections>
    <groups>
       
        <group group_code="GR6">ГОНЧЕТА (СЛЕДОТЪРСАЧИ) И ДРУГИ ПОДОБНИ ПОРОДИ</group>
      

	</groups>
</fci>