<?xml version="1.0" encoding="UTF-8"?>
<!DOCTYPE fci SYSTEM "ASP_DTD.dtd">
<fci>
    <dog_breeds>
        <dog_breed standart_number="SN243" group="GR5" section="S5.1">
            <name>Аляски маламут</name>
            <country country_code="USA"  capital="Washington" official_language="American English"  time_zone = "UTC/GMT -5 hours"  currency="American Dollar">
                <country_name>САЩ</country_name>
                <country_continent>Северна Америка</country_continent>
                <country_government_type>Конституционна федерална република</country_government_type>
            </country>
            <year_of_establishment>1996</year_of_establishment>
            <head>
                Главата е широка и мощна, не груба и тежка, а в пропорция с размера на кучето. Изражението е меко и показва дружелюбното му отношение.
                ЧЕРЕПНА ЧАСТ:
                Череп: Широк и средно заоблен между ушите, като постепенно се стеснява и изравнява отгоре с приближаването към очите, а се заобля към бузите. Между очите има лека бразда. Горната линия на черепа и тази на муцуната при съединяването си образуват лек наклон надолу от правата линия.
                Стоп: Плитък
            </head>
            <teeth>
                Широки, с големи зъби. Резците се срещат в ножична захапка. Обратна или клещовидна захапка е порок.
            </teeth>
            <ears>
                Средноголеми, но малки в съотношение с главата. Ушите са триъгълни по форма и леко заоблени на връхчетата. 
                Те са поставени доста широко по външния заден ръб на черепа на една линия с горния край на окото, като по този начин, когато са наострени, изглеждат сякаш се "разклоняват" от черепа. Наострените уши са насочени леко напред, но когато кучето работи, 
                ушите често са притиснати към черепа. Високо поставените уши са недостатък.
            </ears>
            <eyes>
                Kафяви, бадемовидни, умерено големи, косо поставени. Предпочита се очите да са тъмни. Сините очи са порок. 
                Разположението на очите придава вълчи поглед, но същевременно е мек и дружелюбен.
            </eyes>
            <tail>
                Поставена е така, че се явява продължение на гръбначния стълб, спусната или вдигната над гърба, по форма не е подобна на лисича и не образува плътен пръстен, а по-скоро напомня на развято украшение от пера.
            </tail>
            <colors>
                <primary_color>Вълчи цвят</primary_color>
                <secondary_color>Черно с бяло</secondary_color>
                <prefered_color>И двете разновидности са допустими и са с еднакъв приоритет</prefered_color>
            </colors>
            <fur>
                Трябва да има гъст и твърд покривен космен слой. Подкосмието е плътно, с дължина от 2,5 см до 5 см, мазно и пухкаво. 
                Около врата връхния космен слой е изправен и образува гъста пухкава „яка”. 
                Дължината на козината и подкосмието се мени на различните участъци на тялото – отстрани е къса, а на врата, на рамената, по цялата дължина на гърба и поясницата,
                на задните страни на задните крака и на опашката, е по-дълга.
            </fur>
            <image>https://skydrive.live.com/redir?resid=6F26B1E0D6CF648E!295</image>
            <size>
                <males_size>63.5  см измерено при холката</males_size>
                <females_size>58 см измерено при холката</females_size>
            </size>
            <weight>
                <males_weight>38 кг</males_weight>
                <females_weight>34 кг</females_weight>
            </weight>
        </dog_breed>
        <dog_breed standart_number="SN212" group="GR5" section="S5.1">
        <name>Самоед</name>
            <country country_code="RUS"  capital="Moscow" official_language="Russian"  time_zone = "UTC/GMT +4 hours"  currency="Russian Ruble">
                <country_name>Русия</country_name>
                <country_continent>Евро-Азия</country_continent>
                <country_government_type>Федерация</country_government_type>
            </country>
        <year_of_establishment>1909</year_of_establishment>
        <head>
            Мощна и клиновидна по форма.
            Черепна област:
            Череп: Когато се гледа отпред и отстрани, единствено леко изпъкнал. Широк между ушите. Леко забележима бразда между очите.
            Стоп: Ясно очертан, но немного изразен.
        </head>
        <teeth>
            Съвършена и пълна ножична захапка. Здрави и силни зъби, и челюсти. Нормална зъбна формула.
        </teeth>
        <ears>
            Изправени, по-скоро малки, дебели, триъгълни и леко заоблени във върховете. 
            Те трябва да бъдат подвижни, високо поставени.
            Благодарение на широкия череп са подобаващо раздалечени.
        </ears>
        <eyes>
            Тъмно кафеви на цвят, добре поставени в орбитите си, по-скоро раздалечени,
            до известна степен коси и с бадемовидна форма. Изражението е "усмихващо се", 
            добродушно, жизнено и интелигентно. Очните ръбове са черни.
        </eyes>
        <tail>
            Поставена по-скоро високо. Когато кучето е възбудено или се движи, опашката се носи вдигната върху гърба или отстрани.
            Може да е висяща при покой, като тогава трябва да достига до скакателните стави.
        </tail>
        <colors>
            <primary_color>Чисто бял, кремав</primary_color>
            <secondary_color>Бял с бисквитен отенък</secondary_color>
            <prefered_color>Чисто бял</prefered_color>
        </colors>
        <fur>
            Обилна, дебела, пухкава и гъста покривна козина. Самоеда е куче с двуслойна космена покривка с мек и гъст подкосъм и по-дълъг, по-груб и прав покриващ косъм. 
            Козината трябва да оформя яка около шията и плешките, най-добре проявени при мъжките. 
            По главата и предната страна на крайниците козината е къса и гъста. По външната част на ушите, къса, права и гладка.
        </fur>
            <image>https://skydrive.live.com/redir?resid=6F26B1E0D6CF648E!288</image>
        <size>
            <males_size>57 см измерено при холката</males_size>
            <females_size>53 см измерено при холката</females_size>
        </size>
        <weight>
            <males_weight>32 кг</males_weight>
            <females_weight>29 кг</females_weight>
        </weight>
        </dog_breed>
    </dog_breeds>
    <sections>
        <section section_id="S5.1">Северни впрегатни породи</section>
    </sections>
    <groups>
        <group group_code="GR5">ШПИЦОВЕ И ДРУГИ ПРИМИТИВНИ ПОРОДИ</group>
     </groups>
</fci>