<?xml version="1.0" encoding="UTF-8"?>
<!DOCTYPE fci SYSTEM "ASP_DTD.dtd">
<fci>
    <dog_breeds>
        <dog_breed standart_number="SN235" group="GR2" section="S2.2">
            <name>Немски дог</name>
            <country country_code="GER"  capital="Berlin" official_language="German" time_zone = "UTC/GMT +1 hour"  currency="Euro">
                <country_name>Гемрания</country_name>
                <country_continent>Европа</country_continent>
                <country_government_type>Демокративна и федерална република</country_government_type>
            </country>
            <year_of_establishment>1987</year_of_establishment>
            <head>
                Главата му е тежка като тази на мастифа. Върхът на черепа е почи напълно успореден с муцуната. Това придава на кучето царствен вид.
            </head>
            <teeth>  
                Челюстите са със здрави и бели зъби, правилно разположени, добре вкоренени в развитите челюсти. Захапката е ножицообразна – резците на горната челюст леко покриват резците на долната челюст, като при това се допират един до друг. Допуска се клещовидна захапка. Пастирите са предпочитали именно такава захапка. 
                Изисква се пълна зъбна формула, допуска се отсъствие на двата първи премоляра (2 х Р1), трети молари (М3) не се вземат в предвид.
            </teeth>
            <ears>
                Учите са поставени високо, средно големи, с предни ръбове, плътно лежащи към бузите. В спокойно състояние на кучето висят надолу.
                
            </ears>
            <eyes>
                Очите са средно големи, с бадемовидна форма. Прилягат плътно към клепачите.
                
            </eyes>
            <tail>
                Опашката е високо поставена и дълга, приличаща на сабя. 
                В спокойно състояние е отпусната надолу, а при възбуда и движение – се повдига над продължението на гръбната линия. 
            </tail>
            <colors>
                <primary_color>синя окраска или черна</primary_color>
                <secondary_color>тигрова окраска или петниста</secondary_color>
                <prefered_color> И двете разновидности са приемливи</prefered_color>
            </colors>
            <fur> 
                Немският дог е с късокосмест вид на космената покривка. 
                Космите са къси, гъсти, гладки, лъскави и плътно прилягат към тялото.
                
            </fur>
            <image>https://skydrive.live.com/redir?resid=6F26B1E0D6CF648E!293</image>
            <size>
                <males_size> най - малко 80 см </males_size>
                <females_size>  най - малко 72 см</females_size>
            </size>
            <weight>
                <males_weight>50 - 70 кг  </males_weight>
                <females_weight>50 - 65 кг  </females_weight>
            </weight>
        </dog_breed>
        <dog_breed standart_number="SN1" group="GR7" section="S7.2">
            <name>Английски пойнтер</name>
            <country country_code="GBR"  capital="London" official_language="British English" time_zone = "No UTC/GMT offset"  currency="Pound">
                <country_name>Великобритания</country_name>
                <country_continent>Европа</country_continent>
                <country_government_type>Монархия</country_government_type>
            </country>
            <year_of_establishment>2009</year_of_establishment>
            <head>
                Череп: Със средна ширина, в пропорция с дължината на муцуната. Ясно изразена окципитална кост.
                Стоп: Ясно изразен.
            </head>
            <teeth>  
                Челюст и зъби: Челюстите са силни, с перфектна, 
                симетрична и пълна ножична захапка, т.е. горните резци срещат долните в много тесен контакт и са разположени перпендикулярно на челюстите.
            </teeth>
            <ears>
                С тънка кожа, сравнително високо поставени, висящи, прилегнали по главата, умерено дълги, леко заострени в краищата си.
                
            </ears>
            <eyes>
                На равно разстояние от тила и носната гъба, със сияйно и добродушно изражение. Очите са с цвят на лешник, в съответствие с цвета на козината. Нито изпъкнали, нито широко отворени, нито гледащи под нивото на носа.
                Очните ръбове са тъмни, но може да са по-светли в случаите на лимонено и бяло оцветени кучета.
                
            </eyes>
            <tail>
                Със средна дължина, дебела в основата си, изтъняваща към върха. Опашката е добре покрита с гъсти косми. 
                Кучето я държи на нивото на гърба, без да я извива нагоре.
                При движение, опашката трябва да се размахва в страни.
            </tail>
            <colors>
                <primary_color>лимонено с бяло, оранжево с бяло</primary_color>
                <secondary_color> лешниково с бяло, и черно с бяло</secondary_color>
                <prefered_color> И двете разновидности са приемливи</prefered_color>
            </colors>
            <fur> 
                Косъм: Фин, къс, твърд и равномерно разположен, идеално гладък и прав, с безспорен блясък.
                
            </fur>
            <image>https://skydrive.live.com/redir?resid=6F26B1E0D6CF648E!301</image>
            <size>
                <males_size>64-69 см </males_size>
                <females_size> 61-66 см</females_size>
            </size>
            <weight>
                <males_weight>Около 20 кг </males_weight>
                <females_weight>Около 18 кг </females_weight>
            </weight>
        </dog_breed>
    </dog_breeds>
    <sections>
        <section section_id="S2.2">Догообразни</section>
        <section section_id="S7.2">Британски и ирландски пойнтери и сетери</section>
    </sections>
    <groups>
        <group group_code="GR7">ПТИЧАРИ</group>
        <group group_code="GR2">ПИНЧЕРИ И ШНАУЦЕРИ. ДОГООБРАЗНИ И ШВЕЙЦАРСКИ ПАСТИРСКИ КУЧЕТА</group>
    </groups>
</fci>