<?xml version="1.0" encoding="UTF-8"?>
<!DOCTYPE fci SYSTEM "ASP_DTD.dtd">
    <dog_breeds>
        <dog_breed standart_number="SN270" group="GR5" section="S5.1">
            <name>Сибирско хъски</name>
            <country country_code="USA"  capital="Washington" official_language="American English"  time_zone = "UTC/GMT -5 hours"  currency="American Dollar">
                <country_name>САЩ</country_name>
                <country_continent>Северна Америка</country_continent>
                <country_government_type>Конституционна федерална република</country_government_type>
            </country>
            <year_of_establishment>2000</year_of_establishment>
            <head>
                Череп: Среден на размер и в съответствие с пропорциите на тялото,
                леко заоблен отгоре и се стеснява от най-широката си част към очите
                Стоп: Добре изразен
                Нос: Черен при сивите, бронзовите и черните кучета; с цвят на черен дроб при медночервените; може да бъде с телесен цвят при чисто белите кучета. Приемлив е "снежен нос" с розови ивици
                Муцуна: Средно дълга и средно широка, постепенно се стеснява към носа, връхчето нито е заострено, нито затъпено. От стопа и до върха носният гребен е прав.
                Устни: Добре пигментирани и плътно прилепнали
            </head>
            <teeth>
                Захапката е ножична.
            </teeth>
            <ears>
                Средни по размер, с триъгълна форма, плътно прилепнали и поставени високо на главата.
                Те са дебели, добре окосмени, леко засводени отзад и твърдо изправени, с леко заоблени връхчета, сочещи право нагоре.
            </ears>
            <eyes>
                С бадемовидна форма, средно раздалечени и поставени малко косо.
                Очите могат да бъдат кафеви или сини на цвят, приемливи са също по едно око от цвят или разноцветни (партиколор)
            </eyes>
            <tail>
                Добре окосмената опашка е с форма на четка за прах и е поставена точно под нивото на горната линия.
                Обикновено се носи над гърба в благороден сърп, когато кучето е нащрек. Когато е вдигната, опашката не се навива отстрани на тялото, нито прилепва плътно към гърба.
                Отпусната на нивото на гърба или под него опашка е нормална за кучето, когато е в покой. Космите по опашката са средно дълги и приблизително с една и съща дължина отгоре, отстрани и отдолу, като й придават вид на заоблена четка.
            </tail>
            <colors>
                <primary_color>Черно с бели петна или Бяло с черни петна</primary_color>
                <secondary_color>Чисто бяло или Чисто черно</secondary_color>
                <prefered_color>И двете разновидности са допустими и са с еднакъв приоритет</prefered_color>
            </colors>
            <fur>
                Косъмът на сибирското хъски е двоен и средно дълъг, като му придава вид на добре окосмено куче, но никога не е толкова дълъг, че да закрие ясните очертания на силуета на кучето.
                Подкосъмът е мек и гъст, и достатъчно дълъг, за да поддържа покривния косъм. Космите на покривния косъм са прави и донякъде прилепнали, но никога груби или щръкнали встрани от тялото.
                Трябва да се отбележи, че отсъствието на подкосъм по време на смяната на козината е нормално. Тримингът на мустаците и козината между пръстите и около лапите за придаване на по-спретнат вид е допустим.
                Тримингът на козината в която и да е друга част на кучето не трябва се прощава и се наказва много строго.
            </fur>
            <image>https://skydrive.live.com/redir?resid=6F26B1E0D6CF648E!298</image>
            <size>
                <males_size>53.5 до 60 см измерено при холката</males_size>
                <females_size>50.5 до 56 см измерено при холката</females_size>
            </size>
            <weight>
                <males_weight>20.5 до 28 кг</males_weight>
                <females_weight>15.5 до 23 кг</females_weight>
            </weight>
        </dog_breed>
        <dog_breed standart_number="SN5" group="GR8" section="S8.2">
            <name>Кокер Шпаньол</name>
            <country country_code="GBR"  capital="London" official_language="British English" time_zone = "No UTC/GMT offset"  currency="Pound">
                <country_name>Великобритания</country_name>
                <country_continent>Европа</country_continent>
                <country_government_type>Монархия</country_government_type>
            </country>
            <year_of_establishment>2003</year_of_establishment>
            <head>
                Череп: Добре развит, ясно очертан, нито много фин, нито много груб. 
                Стоп: Отчетлив, разположен в средата между върха на муцуната и тила.
            </head>
            <teeth>  
                Челюсти и зъби: Силни челюсти с перфектна, пълна и завършена ножична захапка, 
                т.е. горните резци плътно припокриват долните, и са перпендикулярни на челюстите.
            </teeth>
            <ears>
                Лобулни, ниско поставени, на нивото на очите. С фина кожа, достигащи върха на носа. Добре покрити с дълги, прави, коприноподобни косми. 
                
            </ears>
            <eyes>
                Пълни, но не изпъкнали. Тъмно кафeви или кафeви, никога светли, но в случаите на червенокафeви, пъстрo червенокафeви или червенокафeви с бяло на цвят кучета, цвят тъмен лешник може да хармонизира с козината. 
                Очите излъчват интелигентност и нежност, но са много будни, блестящи и жизнени. С изпънати ръбове.
                
            </eyes>
            <tail>
                Поставена леко под линията на гърба. Трябва весело да се размахва при движение и се носи хоризонтално, но никога нагоре. Обикновено купирана. 
                
            </tail>
            <colors>
                <primary_color>Черно</primary_color>
                <secondary_color>Шарени</secondary_color>
                <prefered_color>При едноцветните не е позволено бяло</prefered_color>
            </colors>
            <fur> 
                Гладък, с коприноподобна структура, никога твърд или вълнист, без да е твърде обилен и никога къдрав. 
                Добре окосмени предни крайници, тяло и задни крайници над скакателните стави. 
                
            </fur>
            <image>https://skydrive.live.com/redir?resid=6F26B1E0D6CF648E!296</image>
            <size>
                <males_size>39 - 41 см </males_size>
                <females_size> 38 - 39 см</females_size>
            </size>
            <weight>
                <males_weight>12-15 кг </males_weight>
                <females_weight>12-14 кг </females_weight>
            </weight>
        </dog_breed>
    </dog_breeds>
    <sections>
        <section section_id="S5.1">Северни впрегатни породи</section>
        
        <section section_id="S8.2">Претърсващи кучета, С работен изпит </section>
    </sections>
    <groups>
        <group group_code="GR5"> Шпицове и примитивни породи</group>
        <group group_code="GR8"> Апортиращи, претърсващи и водни кучета</group>
    </groups>
